{
  "schema": "bc.v1",
  "manifest": {
    "bc_id": "bc-confidence",
    "profile": "corpus",
    "producer": { "name": "smoothie", "version": "0.1.0" },
    "created_at": "2026-06-29T00:00:00Z",
    "updated_at": "2026-06-29T00:00:00Z",
    "counts": { "sources": 1, "facts": 1, "nodes": 1, "edges": 0, "views": 0, "outlines": 0 }
  },
  "sources": {
    "s1": { "source_id": "s1", "kind": "markdown", "companions": [] }
  },
  "facts": {
    "f1": {
      "fact_id": "f1",
      "kind": "knowledge",
      "text": "A fact whose confidence is out of range.",
      "confidence": 5.0,
      "fidelity": "claimed",
      "source_refs": [ { "source_id": "s1", "span": { "kind": "doc", "section": "intro" } } ],
      "brief_id": "b"
    }
  },
  "graph": {
    "nodes": {
      "n1": {
        "id": "n1",
        "title": "A topic",
        "summary": "Just documentary content.",
        "kind": "topic",
        "fact_ids": ["f1"],
        "checks": [],
        "fidelity": "claimed",
        "source_refs": [ { "source_id": "s1", "span": { "kind": "doc", "section": "intro" } } ]
      }
    },
    "edges": []
  }
}
