{
  "schema": "bc.v1",
  "manifest": {
    "bc_id": "bc-broken-locator",
    "profile": "web-app",
    "producer": { "name": "smoothie", "version": "0.1.0" },
    "created_at": "2026-06-29T00:00:00Z",
    "updated_at": "2026-06-29T00:00:00Z",
    "counts": { "sources": 1, "facts": 0, "nodes": 1, "edges": 0, "views": 0, "outlines": 0 }
  },
  "sources": {
    "s1": { "source_id": "s1", "kind": "pdf", "companions": [] }
  },
  "graph": {
    "nodes": {
      "n1": {
        "id": "n1",
        "title": "Action with an empty locator",
        "summary": null,
        "kind": "action",
        "fact_ids": [],
        "action": {
          "kind": "click",
          "locator": {
            "description": "a button with no selector",
            "primary": { "by": "testid", "value": "" },
            "fallbacks": []
          }
        },
        "checks": [],
        "fidelity": "claimed",
        "source_refs": [ { "source_id": "s1", "span": { "kind": "doc", "page": 1 } } ]
      }
    },
    "edges": []
  }
}
