{
  "schema": "bc.v1",
  "manifest": {
    "bc_id": "bc-broken-launder",
    "profile": "corpus",
    "producer": { "name": "smoothie", "version": "0.1.0" },
    "created_at": "2026-06-29T00:00:00Z",
    "updated_at": "2026-06-29T00:00:00Z",
    "counts": { "sources": 1, "facts": 0, "nodes": 1, "edges": 0, "views": 0, "outlines": 1 }
  },
  "sources": {
    "s1": { "source_id": "s1", "kind": "markdown", "companions": [] }
  },
  "graph": {
    "nodes": {
      "n1": {
        "id": "n1",
        "title": "Only claimed",
        "summary": null,
        "kind": "topic",
        "fact_ids": [],
        "checks": [],
        "fidelity": "claimed",
        "source_refs": [ { "source_id": "s1", "span": { "kind": "doc", "section": "intro" } } ]
      }
    },
    "edges": []
  },
  "outlines": {
    "o1": {
      "outline_id": "o1",
      "brief_id": "b1",
      "title": "Launders trust to confirmed",
      "fidelity": "confirmed",
      "scenes": [
        { "scene_id": "sc1", "title": "scene", "node_ids": ["n1"], "fidelity": "confirmed" }
      ]
    }
  }
}
